dcs_rnd3_058|Cele două victime au fost implicate în accidente rutiere diferite|Cele două victime au fost implicate în accidente rutiere diferite
dcs_rnd3_059|Baclavalele stau la cuptor cam jumătate de ceas|Baclavalele stau la cuptor cam jumătate de ceas
dcs_rnd3_060|Cele mai afectate dintre acestea sunt Ialomița și Dâmbovița|Cele mai afectate dintre acestea sunt Ialomița și Dâmbovița
dcs_rnd3_061|Sunt tot mai rare, dar sunt deosebite|Sunt tot mai rare, dar sunt deosebite
dcs_rnd3_062|Venitul din ultimele două luni al acestor cupluri a fost, practic, zero|Venitul din ultimele două luni al acestor cupluri a fost, practic, zero
dcs_rnd3_063|Aici, medicii au intervenit de urgență, însă românul a decedat|Aici, medicii au intervenit de urgență, însă românul a decedat
dcs_rnd3_064|Mai ales Soderling, care a adus trei puncte|Mai ales Soderling, care a adus trei puncte
dcs_rnd3_065|Acum nu i-am mai luat, pentru că adăpostul era plin cu câini|Acum nu i-am mai luat, pentru că adăpostul era plin cu câini
dcs_rnd3_066|Poate vom vorbi de hidrați de gaz în viitor|Poate vom vorbi de hidrați de gaz în viitor
dcs_rnd3_067|Cred că Vancea trebuie să se hotărască dacă e antrenor sau jucător|Cred că Vancea trebuie să se hotărască dacă e antrenor sau jucător
dcs_rnd3_068|Nu-mi plac oamenii care nu au cuvânt|Nu-mi plac oamenii care nu au cuvânt
dcs_rnd3_069|Ninu, douăzeci și patru|Ninu, douăzeci și patru
dcs_rnd3_070|Antrenorul Dunării Galați, Auraș Brașoveanu, a felicitat echipa din Gruia|Antrenorul Dunării Galați, Auraș Brașoveanu, a felicitat echipa din Gruia
dcs_rnd3_071|Așteptăm nominalizarea pe se de pentru postul vacant|Așteptăm nominalizarea pe se de pentru postul vacant
dcs_rnd3_072|Astra are numai șase puncte în clasament, fiind plasată pe locul paisprezece|Astra are numai șase puncte în clasament, fiind plasată pe locul paisprezece
dcs_rnd3_073|Omul de promisiuni e sătul|Omul de promisiuni e sătul
dcs_rnd3_074|Gane și ceilalți mi-au spus că sunt montați să se califice|Gane și ceilalți mi-au spus că sunt montați să se califice
dcs_rnd3_075|Erau înarmați, am crezut că s-a întâmplat ceva grav|Erau înarmați, am crezut că s-a întâmplat ceva grav
dcs_rnd3_076|Raikkonen nu a reușit să iasă din pluton în primele tururi|Raikkonen nu a reușit să iasă din pluton în primele tururi
dcs_rnd3_077|Antrenorul Florin Ispas a trimis în teren echipa mecea|Antrenorul Florin Ispas a trimis în teren echipa mecea
dcs_rnd3_078|După ce m-am lăsat de sport, s-au schimbat datele problemei|După ce m-am lăsat de sport, s-au schimbat datele problemei
dcs_rnd3_079|M-am speriat de moarte|M-am speriat de moarte
dcs_rnd3_080|Raportul împărțea țările din est în două grupuri|Raportul împărțea țările din est în două grupuri
dcs_rnd3_081|Antrenorul lui Dinamo și-a făcut temele înaintea meciului de astăzi|Antrenorul lui Dinamo și-a făcut temele înaintea meciului de astăzi
dcs_rnd3_082|Nu este o zi ușoară pentru mine|Nu este o zi ușoară pentru mine
dcs_rnd3_083|Habar nu aveam ce face Jean acolo|Habar nu aveam ce face Jean acolo
dcs_rnd3_084|Nu îmi pot imagina viața fără animale|Nu îmi pot imagina viața fără animale
dcs_rnd3_085|Bujar Nishani, precedentul ministru de interne, a primit portofoliul de la justiție|Bujar Nishani, precedentul ministru de interne, a primit portofoliul de la justiție
dcs_rnd3_086|Nu iert pe nimeni|Nu iert pe nimeni
dcs_rnd3_087|Aceștia s-au aflat pe Bulevardul Revoluția din decembrie|Aceștia s-au aflat pe Bulevardul Revoluția din decembrie
dcs_rnd3_088|Acțiunea s-a desfășurat cu restricții de circulație, cu filtru selectiv|Acțiunea s-a desfășurat cu restricții de circulație, cu filtru selectiv
dcs_rnd3_089|Și să-l cânte fără greșeală|Și să-l cânte fără greșeală
dcs_rnd3_090|Timpul a consumat ce era de consumat|Timpul a consumat ce era de consumat
dcs_rnd3_091|S-a dispus neîncetarea urmării penale, pentru că tânăra și-a retras plângerea|S-a dispus neîncetarea urmării penale, pentru că tânăra și-a retras plângerea
dcs_rnd3_092|Nu era obligatoriu să facă asta|Nu era obligatoriu să facă asta
dcs_rnd3_093|Pe noi criza nu ne-a atins în două mii opt|Pe noi criza nu ne-a atins în două mii opt
dcs_rnd3_094|Doris este patiseria bine cunoscută de sibieni, așezată în piața mică|Doris este patiseria bine cunoscută de sibieni, așezată în piața mică
dcs_rnd3_095|Chiria medie este de zece euro pe metru pătrat, plus te ve a|Chiria medie este de zece euro pe metru pătrat, plus te ve a
dcs_rnd3_096|Am citit din creațiile noastre acolo|Am citit din creațiile noastre acolo
dcs_rnd3_097|În autoturism se afla o familie, mama, tata și doi adolescenți|În autoturism se afla o familie, mama, tata și doi adolescenți
dcs_rnd3_098|Dacă mai erau trei minute poate egalam|Dacă mai erau trei minute poate egalam
dcs_rnd3_099|Nu știu, poate le dau altceva să mănânce, a glumit antrenorul Unirii|Nu știu, poate le dau altceva să mănânce, a glumit antrenorul Unirii
dcs_rnd3_100|Copilul a fost transportat la spitalul județean Brașov pentru îngrijri de specialitate|Copilul a fost transportat la spitalul județean Brașov pentru îngrijri de specialitate
dcs_rnd3_101|Când era foarte mic, însă, nu obișnuia să scrie versuri|Când era foarte mic, însă, nu obișnuia să scrie versuri
dcs_rnd3_102|Ce alte colaborări vei avea pe viitor|Ce alte colaborări vei avea pe viitor
dcs_rnd3_103|Robert Klein a fost înjunghiat duminică seara în jurul orei doi|Robert Klein a fost înjunghiat duminică seara în jurul orei doi
dcs_rnd3_104|Eu doar l-am împins pe primar|Eu doar l-am împins pe primar
dcs_rnd3_105|Cum vă alegeați victimele|Cum vă alegeați victimele
dcs_rnd3_106|Pe una din aceste bucăți au găsit reprezentate mai multe animale fugind|Pe una din aceste bucăți au găsit reprezentate mai multe animale fugind
dcs_rnd3_107|Sâmbătă noaptea se va circulă însă pe o singură bandă|Sâmbătă noaptea se va circulă însă pe o singură bandă
dcs_rnd3_108|Am mers în jos|Am mers în jos
dcs_rnd3_109|Universitățile noastre nu au în vedere un asemenea aspect|Universitățile noastre nu au în vedere un asemenea aspect
dcs_rnd3_110|Echipa elevi a concurat în trei probe|Echipa elevi a concurat în trei probe
dcs_rnd3_111|Procurorii îi bănuiesc însă și de alte douăzeci de spargeri|Procurorii îi bănuiesc însă și de alte douăzeci de spargeri
dcs_rnd3_112|În acest an doi și-au pierdut serviciul din acest motiv|În acest an doi și-au pierdut serviciul din acest motiv
dcs_rnd3_113|Dar, cu toate acestea, i-am zis să vorbească|Dar, cu toate acestea, i-am zis să vorbească
dcs_rnd3_114|Nu avem decât varianta victoriei|Nu avem decât varianta victoriei
dcs_rnd3_115|Cântăm împreună, dansăm și râdem cât putem de mult|Cântăm împreună, dansăm și râdem cât putem de mult
dcs_rnd3_116|Sunt probleme cu banii, însă nu trebuie să facem atâta caz|Sunt probleme cu banii, însă nu trebuie să facem atâta caz
dcs_rnd3_117|Viața mea a fost o luptă pentru a face bine oamenilor|Viața mea a fost o luptă pentru a face bine oamenilor
dcs_rnd3_118|De altfel, am cinci copii|De altfel, am cinci copii
dcs_rnd3_119|Lui marius nu-i place să fie mințit|Lui marius nu-i place să fie mințit
dcs_rnd3_120|În centrul ei, situația din Statele Unite ale Americii|În centrul ei, situația din Statele Unite ale Americii
dcs_rnd3_121|Automobilele și ambarcațiunile oferite cadou de către dezvoltatori, nu conving clienții|Automobilele și ambarcațiunile oferite cadou de către dezvoltatori, nu conving clienții
dcs_rnd3_122|Chiar ieri mi-a scris o prietenă din Anglia|Chiar ieri mi-a scris o prietenă din Anglia
dcs_rnd3_123|Era foarte interesat de meniul din acea seară își amintește Doherty|Era foarte interesat de meniul din acea seară își amintește Doherty
dcs_rnd3_124|Este un meci fundamental, jucăm împotriva celei mai dificile echipe din grupă|Este un meci fundamental, jucăm împotriva celei mai dificile echipe din grupă
dcs_rnd3_125|Pentru acest sezon, universitatea are ca obiectiv să ajungă în finala competiției|Pentru acest sezon, universitatea are ca obiectiv să ajungă în finala competiției
dcs_rnd3_126|Documentația tehnică în vederea obținerii acordului de mediu a fost deja depusă|Documentația tehnică în vederea obținerii acordului de mediu a fost deja depusă
dcs_rnd3_127|Opt punct zero zero|Opt punct zero zero
dcs_rnd3_128|Îmi plac foarte mult tehnicile de șold|Îmi plac foarte mult tehnicile de șold
dcs_rnd3_129|Au fost controlați optzeci și șapte de operatori economici|Au fost controlați optzeci și șapte de operatori economici
dcs_rnd3_130|Pandi la pauză s-a întâmplat tot|Pandi la pauză s-a întâmplat tot
dcs_rnd3_131|Pentru a fi mai operativi, unii au împărțit rândurile cu părinții|Pentru a fi mai operativi, unii au împărțit rândurile cu părinții
dcs_rnd3_132|Drogurile proveneau din Olanda și erau ascunse într-o combină muzicală veche|Drogurile proveneau din Olanda și erau ascunse într-o combină muzicală veche
dcs_rnd3_133|Viitorul era promițător, dar am fost demis pe nedrept|Viitorul era promițător, dar am fost demis pe nedrept
dcs_rnd3_134|Dar viața naște viață|Dar viața naște viață
dcs_rnd3_135|Nu știu cine are dreptate sau nu|Nu știu cine are dreptate sau nu
dcs_rnd3_136|Condescu s-a înțeles cu cei de la Dinamo|Condescu s-a înțeles cu cei de la Dinamo
dcs_rnd3_137|Echipa a arătat acel spirit care ne-a făcut să câștigăm campionatul|Echipa a arătat acel spirit care ne-a făcut să câștigăm campionatul
dcs_rnd3_138|Or, mi s-a părut scandalos|Or, mi s-a părut scandalos
dcs_rnd3_139|Stilul baroc este evidențiat de elementele structurale|Stilul baroc este evidențiat de elementele structurale
dcs_rnd3_140|Au spus rudele împușcatului|Au spus rudele împușcatului
dcs_rnd3_141|Fuziunea pământurilor a subliniat cea mai importantă bază agroalimentară, terra|Fuziunea pământurilor a subliniat cea mai importantă bază agroalimentară, terra
dcs_rnd3_142|Regret că nu am fost lângă el la operație|Regret că nu am fost lângă el la operație
dcs_rnd3_143|Dar nu în industria auto|Dar nu în industria auto
dcs_rnd3_144|Spre deosebire de anii precedenți, nu s-au mai înregistrat cazuri de scarlatină|Spre deosebire de anii precedenți, nu s-au mai înregistrat cazuri de scarlatină
dcs_rnd3_145|Femeile sunt la parter, iar bărbații au etajele unu și doi|Femeile sunt la parter, iar bărbații au etajele unu și doi
dcs_rnd3_146|Senatori liberali din Cehia vor contesta tratatul de la curtea constituțională|Senatori liberali din Cehia vor contesta tratatul de la curtea constituțională
dcs_rnd3_147|După ansamblul meciului totuși, cred că meritam victoria|După ansamblul meciului totuși, cred că meritam victoria
dcs_rnd3_148|Cu toate bâlbele noastre în defensivă, am băgat regulamentar mingea în plasă|Cu toate bâlbele noastre în defensivă, am băgat regulamentar mingea în plasă
dcs_rnd3_149|Ocupația nu îi ajută însă să scadă cheltuielile cu mâncarea|Ocupația nu îi ajută însă să scadă cheltuielile cu mâncarea
dcs_rnd3_150|Spațiul verde din sensul giratoriu|Spațiul verde din sensul giratoriu
dcs_rnd3_151|Suntem la a patra ediție în Baia Mare|Suntem la a patra ediție în Baia Mare
dcs_rnd3_152|Porterii ne așteptau cu floricele de porumb proaspăt făcute și ceai cald|Porterii ne așteptau cu floricele de porumb proaspăt făcute și ceai cald
dcs_rnd3_153|Nu pot concepe o viață trăită cu indiferență|Nu pot concepe o viață trăită cu indiferență
dcs_rnd3_154|Ulterior din bancă, banii erau ridicați de alte persoane|Ulterior din bancă, banii erau ridicați de alte persoane
dcs_rnd3_155|Prietenele mele cele mai bune de aici sunt unguroaice|Prietenele mele cele mai bune de aici sunt unguroaice
dcs_rnd3_156|Nu aveau ei cum să intre pe stadion, chiar dacă vroiau|Nu aveau ei cum să intre pe stadion, chiar dacă vroiau
dcs_rnd3_157|Și doi ani mai târziu, când au adăugat complexului un grup sanitar|Și doi ani mai târziu, când au adăugat complexului un grup sanitar
dcs_rnd3_158|După supracazări, aproape toți studenții noștri au prins un loc în cămin|După supracazări, aproape toți studenții noștri au prins un loc în cămin
dcs_rnd3_159|Accesul publicului este gratuit cu posibilitatea parcării autoturismelor în zonă|Accesul publicului este gratuit cu posibilitatea parcării autoturismelor în zonă
dcs_rnd3_160|Irimescu și Nicola au fost foarte buni|Irimescu și Nicola au fost foarte buni
dcs_rnd3_161|Sunt mulțumit că brawn a reușit rezultate impresionante|Sunt mulțumit că brawn a reușit rezultate impresionante
dcs_rnd3_162|Ulterior, investigația a fost extinsă pentru a include întreg grupul american Google|Ulterior, investigația a fost extinsă pentru a include întreg grupul american Google
dcs_rnd3_163|Regulile en bi ei sunt foarte stricte în ceea ce privește investițiile străine|Regulile en bi ei sunt foarte stricte în ceea ce privește investițiile străine
dcs_rnd3_164|Trăim într-o sărăcie intelectuală, în favoarea goanei materialiste|Trăim într-o sărăcie intelectuală, în favoarea goanei materialiste
dcs_rnd3_165|Ei au realizat un cilindru, care conține un burete|Ei au realizat un cilindru, care conține un burete
dcs_rnd3_166|Odată automatizate, stațiile electrice de transformare vor fi conduse de la distanță|Odată automatizate, stațiile electrice de transformare vor fi conduse de la distanță
dcs_rnd3_167|Întâlniri asemănătoare au avut loc la Washington și Melbourne|Întâlniri asemănătoare au avut loc la Washington și Melbourne
dcs_rnd3_168|A început să devină enervant, dar e de înțeles|A început să devină enervant, dar e de înțeles
dcs_rnd3_169|Mașina pornește din Baia Mare spre Sighet prin Pasul Gutâi|Mașina pornește din Baia Mare spre Sighet prin Pasul Gutâi
dcs_rnd3_170|În continuare polițiștii acționează pentru prinderea lui|În continuare polițiștii acționează pentru prinderea lui
dcs_rnd3_171|Tatăl meu nu a făcut nicio presiune|Tatăl meu nu a făcut nicio presiune
dcs_rnd3_172|De asemenea, la debut s-a aflat și fundașul Vali Năstase|De asemenea, la debut s-a aflat și fundașul Vali Năstase
dcs_rnd3_173|Cei trei tineri sunt arestați pentru douăzeci și patru de ore preventiv|Cei trei tineri sunt arestați pentru douăzeci și patru de ore preventiv
dcs_rnd3_174|M-au luat cu forța și nu mi-au dat decât apă|M-au luat cu forța și nu mi-au dat decât apă
dcs_rnd3_175|Trebuie să știu să fac de toate|Trebuie să știu să fac de toate
dcs_rnd3_176|Cântărește doar patruzeci și opt de kilograme|Cântărește doar patruzeci și opt de kilograme
dcs_rnd3_177|Arcelormittal Galați a încheiat un parteneriat cu a hași ge|Arcelormittal Galați a încheiat un parteneriat cu a hași ge
dcs_rnd3_178|Groapa era semnalizată, iar mașina aparține firmei Next Taxi|Groapa era semnalizată, iar mașina aparține firmei Next Taxi
dcs_rnd3_179|Citroen m-a contactat săptămâna trecută pentru a îmi oferi un angajament|Citroen m-a contactat săptămâna trecută pentru a îmi oferi un angajament
dcs_rnd3_180|Ne așteptam ca acest lucru să fie cumva sofisticat|Ne așteptam ca acest lucru să fie cumva sofisticat
dcs_rnd3_181|Iubesc plimbările la munte și weekendurile libere|Iubesc plimbările la munte și weekendurile libere
dcs_rnd3_182|Nu pot să le uit pe astea niciodată|Nu pot să le uit pe astea niciodată
dcs_rnd3_183|Pe deasupra, el se confruntă și cu răutățile și respingerea celorlalți copii|Pe deasupra, el se confruntă și cu răutățile și respingerea celorlalți copii
dcs_rnd3_184|Josh Mitchell revine pe gazon după o pauză de șase luni|Josh Mitchell revine pe gazon după o pauză de șase luni
dcs_rnd3_185|Pe alții i-am angajat după ce am văzut di vi di-uri cu reprezentații|Pe alții i-am angajat după ce am văzut di vi di-uri cu reprezentații
dcs_rnd3_186|Ce i-a placut sau nu la echipa|Ce i-a placut sau nu la echipa
dcs_rnd3_187|Norvegianul i-a remarcat pe argentinienii ce fe re-ului, subliniind că aceștia pot face diferența|Norvegianul i-a remarcat pe argentinienii ce fe re-ului, subliniind că aceștia pot face diferența
dcs_rnd3_188|Acum, n-ai de unde face banul|Acum, n-ai de unde face banul
dcs_rnd3_189|În foarte multe|În foarte multe
dcs_rnd3_190|Nu pot fi vândute pentru că prețul ar fi unul foarte mare|Nu pot fi vândute pentru că prețul ar fi unul foarte mare
dcs_rnd3_191|Nu-mi place răutatea și prostia|Nu-mi place răutatea și prostia
dcs_rnd3_192|Cultivă porumb și grâu și începe să vâneze|Cultivă porumb și grâu și începe să vâneze
dcs_rnd3_193|Se poate să fi fost fault, dar doar arbitrul știe|Se poate să fi fost fault, dar doar arbitrul știe
dcs_rnd3_194|Dacă nava se oprește în larg, delfinii se sperie și pleacă|Dacă nava se oprește în larg, delfinii se sperie și pleacă
dcs_rnd3_195|Șoferița va fi cercetată numai pentru conducere sub influența băuturilor alcoolice|Șoferița va fi cercetată numai pentru conducere sub influența băuturilor alcoolice
dcs_rnd3_196|Știe rețeta de când era doar o copilă|Știe rețeta de când era doar o copilă
dcs_rnd3_197|Treizeci și cinci ani, fără ocupație, din localitate|Treizeci și cinci ani, fără ocupație, din localitate
dcs_rnd3_198|Cinci mii patru sute șaizeci și șapte euro|Cinci mii patru sute șaizeci și șapte euro
dcs_rnd3_199|Am găsit o chirie, tot pe Iuliu Maniu, dar merge foarte prost|Am găsit o chirie, tot pe Iuliu Maniu, dar merge foarte prost
dcs_rnd3_200|Am fost și la Roland Garros|Am fost și la Roland Garros
dcs_rnd3_201|El coboară din mașină și dă actele, inclusiv ale șoferului, la control|El coboară din mașină și dă actele, inclusiv ale șoferului, la control
dcs_rnd3_202|Dădea apoi comenzi celorlalți complici, de fabricare a cardurilor false|Dădea apoi comenzi celorlalți complici, de fabricare a cardurilor false
dcs_rnd3_203|Este patru dimineața și sunt minus douăzeci de grade celsius|Este patru dimineața și sunt minus douăzeci de grade celsius
dcs_rnd3_204|De asemenea, vom lucra și la regulamentul de ordine|De asemenea, vom lucra și la regulamentul de ordine
dcs_rnd3_205|Conductorul nu a observat la timp semnalul care interzicea accesul pe linie|Conductorul nu a observat la timp semnalul care interzicea accesul pe linie
dcs_rnd3_206|Ianis, hai să nu ne grăbim|Ianis, hai să nu ne grăbim
dcs_rnd3_207|Iranul face în mod regulat exerciții militare și anunță teste de armament|Iranul face în mod regulat exerciții militare și anunță teste de armament
dcs_rnd3_208|Eu le fac să te țină cincizeci de ani|Eu le fac să te țină cincizeci de ani
dcs_rnd3_209|Tot ce este verde|Tot ce este verde
dcs_rnd3_210|Unirea ar putea primi anul acesta aproximativ două milioane de euro|Unirea ar putea primi anul acesta aproximativ două milioane de euro
dcs_rnd3_211|Sincer vorbind, nu putem da acum pronosticuri|Sincer vorbind, nu putem da acum pronosticuri
dcs_rnd3_212|De aceea, specialiștii recomandă schimbarea periodică a dușului|De aceea, specialiștii recomandă schimbarea periodică a dușului
dcs_rnd3_213|De aici și până la vreo lege e cale lungă|De aici și până la vreo lege e cale lungă
dcs_rnd3_214|Nu sunt supărat pe Mihai|Nu sunt supărat pe Mihai
dcs_rnd3_215|Nu vreau să comentez reacția suporterilor la adresa mea|Nu vreau să comentez reacția suporterilor la adresa mea
dcs_rnd3_216|Mi-am cumpărat pământ și mi-am făcut o grădină|Mi-am cumpărat pământ și mi-am făcut o grădină
dcs_rnd3_217|Majoritatea sunt copii din mediul rural și frecventează cursurile gimnaziale|Majoritatea sunt copii din mediul rural și frecventează cursurile gimnaziale
dcs_rnd3_218|În plus, nu îngrașă|În plus, nu îngrașă
dcs_rnd3_219|Și așa, mai trebuie renovate că sunt unele care arată tare rău|Și așa, mai trebuie renovate că sunt unele care arată tare rău
dcs_rnd3_220|După slujbă, familia se adună în jurul mesei|După slujbă, familia se adună în jurul mesei
dcs_rnd3_221|Sălile de clasă au fost curățate și dezinfectate|Sălile de clasă au fost curățate și dezinfectate
dcs_rnd3_222|Cât de mari sunt indemnizațiile românilor care au lucrat legal în străinătate|Cât de mari sunt indemnizațiile românilor care au lucrat legal în străinătate
dcs_rnd3_223|Nu știu ce a apreciat Gigi Becali la mine, nu l-am întrebat|Nu știu ce a apreciat Gigi Becali la mine, nu l-am întrebat
dcs_rnd3_224|Acum raportul este schimbat|Acum raportul este schimbat
dcs_rnd3_225|Din acest motiv au decis să aleagă varianta cea mai ieftină|Din acest motiv au decis să aleagă varianta cea mai ieftină
dcs_rnd3_226|Nu reușim să ne facem glicemia prea des, din păcate|Nu reușim să ne facem glicemia prea des, din păcate
dcs_rnd3_227|Eu sunt de modă veche din acest punct de vedere și conservatoristă|Eu sunt de modă veche din acest punct de vedere și conservatoristă
dcs_rnd3_228|Așa nu va fi nicio problemă dacă nu vin la cursuri|Așa nu va fi nicio problemă dacă nu vin la cursuri
dcs_rnd3_229|Ecuadorul și columbia vor avea primul contact diplomatic|Ecuadorul și columbia vor avea primul contact diplomatic
dcs_rnd3_230|Pe vremea mea, îi băteam mai mereu pe rapidiști la Craiova|Pe vremea mea, îi băteam mai mereu pe rapidiști la Craiova
dcs_rnd3_231|Am tras în legitimă apărare|Am tras în legitimă apărare
dcs_rnd3_232|Am fost profund impresionat de promovarea mierii ca produs autohton|Am fost profund impresionat de promovarea mierii ca produs autohton
dcs_rnd3_233|Aveam chiar și clase de cincizeci de elevi|Aveam chiar și clase de cincizeci de elevi
dcs_rnd3_234|Aceasta povestește și cum a ajuns în situația aceasta|Aceasta povestește și cum a ajuns în situația aceasta
dcs_rnd3_235|Suma nu include salarii, ci doar drepturi conferite prin legi speciale|Suma nu include salarii, ci doar drepturi conferite prin legi speciale
dcs_rnd3_236|Vom face tot posibilul să-l recuperăm|Vom face tot posibilul să-l recuperăm
dcs_rnd3_237|Cercetările vizează, de asemenea, rețete eliberate pentru bolnavi de cancer|Cercetările vizează, de asemenea, rețete eliberate pentru bolnavi de cancer
dcs_rnd3_238|Știu că suntem zburdalnici în trafic, greșim și noi|Știu că suntem zburdalnici în trafic, greșim și noi
dcs_rnd3_239|După părerea mea, a fost fault la portar sută la sută|După părerea mea, a fost fault la portar sută la sută
dcs_rnd3_240|Haris, în vârstă de douăzeci ani|Haris, în vârstă de douăzeci ani
dcs_rnd3_241|Vom înainta o cerere de finanțare pentru a atrage fonduri europene|Vom înainta o cerere de finanțare pentru a atrage fonduri europene
dcs_rnd3_242|Mansardele blocurilor și parterele au fost cumpărate|Mansardele blocurilor și parterele au fost cumpărate
dcs_rnd3_243|A venit rândul lui Viziru să lovească|A venit rândul lui Viziru să lovească
dcs_rnd3_244|Am aflat abia acum, după ce am văzut înregistrarea|Am aflat abia acum, după ce am văzut înregistrarea
dcs_rnd3_245|Diseară, e mare petrecere|Diseară, e mare petrecere
dcs_rnd3_246|E un om deosebit|E un om deosebit
dcs_rnd3_247|Asta dacă vor să se simtă bine|Asta dacă vor să se simtă bine
dcs_rnd3_248|Noi cerem fotbaliștilor să fie serioși și pozitivi|Noi cerem fotbaliștilor să fie serioși și pozitivi
dcs_rnd3_249|Toți jucătorii de la echipă lucrează la finalizare|Toți jucătorii de la echipă lucrează la finalizare
dcs_rnd3_250|Prejudiciul a fost recuperat|Prejudiciul a fost recuperat
dcs_rnd3_251|Despărțirea de Andreea Pătrașcu l-a dat peste cap pe Cabral|Despărțirea de Andreea Pătrașcu l-a dat peste cap pe Cabral
dcs_rnd3_252|Fenerbahce este o echipă care luptă în fiecare sezon, pe toate fronturile|Fenerbahce este o echipă care luptă în fiecare sezon, pe toate fronturile
dcs_rnd3_253|Care-i problema, a declarat senatorul de Ialomița, Maria Petre|Care-i problema, a declarat senatorul de Ialomița, Maria Petre
dcs_rnd3_254|Apoi, la doar un minut, Ceahlăul a beneficiat și de un penalty|Apoi, la doar un minut, Ceahlăul a beneficiat și de un penalty
dcs_rnd3_255|Cele două familii sunt în conflict de mai multă vreme|Cele două familii sunt în conflict de mai multă vreme
dcs_rnd3_256|Sunt la curent cu tot ce se întâmplă în România|Sunt la curent cu tot ce se întâmplă în România
dcs_rnd3_257|Reabilitarea trebuie să fie finalizată peste două luni|Reabilitarea trebuie să fie finalizată peste două luni
dcs_rnd3_258|Marius a adăugat că nu-i plac deloc melodiile rock și nici telenovelele|Marius a adăugat că nu-i plac deloc melodiile rock și nici telenovelele
dcs_rnd3_259|Pe mine m-a costat patru sute de euro|Pe mine m-a costat patru sute de euro
dcs_rnd3_260|Pe mulți nu îi interesează să apară la te ve|Pe mulți nu îi interesează să apară la te ve
dcs_rnd3_261|În total este vorba despre aproximativ șaizeci de mii de lei|În total este vorba despre aproximativ șaizeci de mii de lei
dcs_rnd3_262|M-am îndrăgostit de ele, a spus Piersic despre melodiile lui Iagnov|M-am îndrăgostit de ele, a spus Piersic despre melodiile lui Iagnov
dcs_rnd3_263|Deocamdată, din constatările pe care le-am făcut|Deocamdată, din constatările pe care le-am făcut
dcs_rnd3_264|Am adoptat un stil de viață naturist, am eliminat până și carnea|Am adoptat un stil de viață naturist, am eliminat până și carnea
dcs_rnd3_265|De aceea spun că schimbările sunt fundamentale|De aceea spun că schimbările sunt fundamentale
